{
  "contractVersion": "v1",
  "eventId": "evt_golden_001",
  "requestId": "req_golden_001",
  "sessionId": "sess_golden_001",
  "poiCode": "POI_GOLDEN",
  "language": "en",
  "userType": "guest",
  "userId": null,
  "deviceId": "device_golden_001",
  "status": "app_event",
  "durationMs": 0,
  "timestamp": "2026-04-18T12:00:00.000Z",
  "source": "qr_scan",
  "actionType": "scan",
  "networkType": "wifi",
  "userApproved": null,
  "fetchTriggered": false,
  "latitude": 10.5,
  "longitude": 106.6,
  "geoRadiusMeters": 25,
  "geoSource": "qr",
  "batchItemCount": null
}
